{
  "$schema": "http://json-schema.org/draft-07/schema#",
  "title": "EQ-PROOF Spec",
  "type": "object",
  "required": [
    "name",
    "version",
    "variables",
    "constraints"
  ],
  "properties": {
    "name": {
      "type": "string"
    },
    "version": {
      "type": "string"
    },
    "variables": {
      "type": "array",
      "items": {
        "type": "string"
      }
    },
    "constraints": {
      "type": "array",
      "items": {
        "type": "object"
      }
    },
    "probes": {
      "type": "array",
      "items": {
        "type": "object"
      }
    },
    "alternates": {
      "type": "array",
      "items": {
        "type": "string"
      }
    },
    "units": {
      "type": "object",
      "additionalProperties": {
        "type": "string"
      }
    },
    "fixed": {
      "type": "array",
      "items": {
        "type": "string"
      }
    }
  }
}
